source_file,speaker_id,utterance_id,filename_valid,response_mode,status,processing_seconds,transcript,normalized_text,tagged_input,response_text,audio_output,error
2325_audio3.wav,2325,audio3,True,preserve_cs,ok,41.99978780001402,Lai Lai Lai Lai Lai Lai Lai Lai Lai Lai Lai Lai Lai Lai Lai Lai Lai Lai Lai Lai Lai Lai Lai Lai Lai Lai Lai Lai Lai Lai Lai Lai Lai Lai Lai Lai Lai Lai Lai Lai Lai Lai Lai Lai Lai Lai Lai Lai Lai Lai Lai Lai Lai Lai Lai Lai Lai Lai Lai Lai Lai Lai Lai Lai Lai Lai Lai Lai Lai Lai Lai Lai Lai Lai Lai Lai Lai Lai Lai Lai Lai Lai Lai Lai Lai Lai Lai Lai Lai Lai Lai Lai Lai Lai Lai Lai Lai Lai Lai Lai Lai Lai Lai Lai Lai Lai Lai Lai Lai Lai Lai Lai Lai Lai Lai Lai Lai Lai Lai Lai Lai Lai Lai Lai Lai Lai Lai Lai Lai Lai Lai Lai Lai Lai Lai Lai Lai Lai Lai Lai Lai Lai Lai Lai Lai Lai Lai Lai Lai Lai Lai Lai Lai Lai Lai Lai Lai Lai Lai Lai Lai Lai Lai Lai Lai Lai Lai Lai Lai Lai Lai Lai Lai Lai Lai Lai Lai Lai Lai Lai Lai Lai Lai Lai Lai Lai Lai Lai Lai Lai Lai Lai Lai Lai Lai Lai Lai Lai Lai Lai Lai Lai Lai Lai Lai Lai Lai Lai Lai Lai Lai Lai Lai Lai Lai Lai Lai Lai Lai Lai Lai Lai,Lai Lai Lai Lai Lai Lai Lai Lai Lai Lai Lai Lai Lai Lai Lai Lai Lai Lai Lai Lai Lai Lai Lai Lai Lai Lai Lai Lai Lai Lai Lai Lai Lai Lai Lai Lai Lai Lai Lai Lai Lai Lai Lai Lai Lai Lai Lai Lai Lai Lai Lai Lai Lai Lai Lai Lai Lai Lai Lai Lai Lai Lai Lai Lai Lai Lai Lai Lai Lai Lai Lai Lai Lai Lai Lai Lai Lai Lai Lai Lai Lai Lai Lai Lai Lai Lai Lai Lai Lai Lai Lai Lai Lai Lai Lai Lai Lai Lai Lai Lai Lai Lai Lai Lai Lai Lai Lai Lai Lai Lai Lai Lai Lai Lai Lai Lai Lai Lai Lai Lai Lai Lai Lai Lai Lai Lai Lai Lai Lai Lai Lai Lai Lai Lai Lai Lai Lai Lai Lai Lai Lai Lai Lai Lai Lai Lai Lai Lai Lai Lai Lai Lai Lai Lai Lai Lai Lai Lai Lai Lai Lai Lai Lai Lai Lai Lai Lai Lai Lai Lai Lai Lai Lai Lai Lai Lai Lai Lai Lai Lai Lai Lai Lai Lai Lai Lai Lai Lai Lai Lai Lai Lai Lai Lai Lai Lai Lai Lai Lai Lai Lai Lai Lai Lai Lai Lai Lai Lai Lai Lai Lai Lai Lai Lai Lai Lai Lai Lai Lai Lai Lai Lai,[ID]Lai Lai Lai Lai Lai Lai Lai Lai Lai Lai Lai Lai Lai Lai Lai Lai Lai Lai Lai Lai Lai Lai Lai Lai Lai Lai Lai Lai Lai Lai Lai Lai Lai Lai Lai Lai Lai Lai Lai Lai Lai Lai Lai Lai Lai Lai Lai Lai Lai Lai Lai Lai Lai Lai Lai Lai Lai Lai Lai Lai Lai Lai Lai Lai Lai Lai Lai Lai Lai Lai Lai Lai Lai Lai Lai Lai Lai Lai Lai Lai Lai Lai Lai Lai Lai Lai Lai Lai Lai Lai Lai Lai Lai Lai Lai Lai Lai Lai Lai Lai Lai Lai Lai Lai Lai Lai Lai Lai Lai Lai Lai Lai Lai Lai Lai Lai Lai Lai Lai Lai Lai Lai Lai Lai Lai Lai Lai Lai Lai Lai Lai Lai Lai Lai Lai Lai Lai Lai Lai Lai Lai Lai Lai Lai Lai Lai Lai Lai Lai Lai Lai Lai Lai Lai Lai Lai Lai Lai Lai Lai Lai Lai Lai Lai Lai Lai Lai Lai Lai Lai Lai Lai Lai Lai Lai Lai Lai Lai Lai Lai Lai Lai Lai Lai Lai Lai Lai Lai Lai Lai Lai Lai Lai Lai Lai Lai Lai Lai Lai Lai Lai Lai Lai Lai Lai Lai Lai Lai Lai Lai Lai Lai Lai Lai Lai Lai Lai Lai Lai Lai Lai Lai[/ID],"Maaf, saya tidak mengerti apa yang Anda maksud.",D:\Semester6\NLP\Prak\UAS\UAS-Praktikum-Pemrosesan-Bahasa-Alami\outputs\tts\2325_audio3_resp_preserve_cs.wav,
2325_audio4.wav,2325,audio4,True,preserve_cs,ok,35.98408189998008,like like like like like like like like like like like like like like like like like like like like like like like like like like like like like like like like like like like like like like like like like like like like like like like like like like like like like like like like like like like like like like like like like like like like like like like like like like like like like like like like like like like like like like like like like like like like like like like like like like like like like like like like like like like like like like like like like like like like like like like like like like like like like like like like like like like like like like like like like like like like like like like like like like like like like like like like like like like like like like like like like like like like like like like like like like like like like like like like like like like like like like like like like like like like like like like like like like like like like like like like like like like like like like like like like like like like like like like like like like like like like like like like like like like like like like like like like like like like like like like like like like like like like like like like like like like like like like like like like like like like like like like like like like like like like like like like like like like like like like like like like like like like like like like like like like like like like like like like like like like like like like like like like like like like like like like like like like like like like like like like like like like like like like like like like like like like like like like like like like like like like like like like like like like like like like like like like like like like like like like like like like like like like like like like like like like like like like like like like like like like like like like like like like like like like like like like like like like like like like like like like like like like like like like like like like like like like like like like like like like like like like like like like like like like like like like like like like like like like like like like like like like like,like like like like like like like like like like like like like like like like like like like like like like like like like like like like like like like like like like like like like like like like like like like like like like like like like like like like like like like like like like like like like like like like like like like like like like like like like like like like like like like like like like like like like like like like like like like like like like like like like like like like like like like like like like like like like like like like like like like like like like like like like like like like like like like like like like like like like like like like like like like like like like like like like like like like like like like like like like like like like like like like like like like like like like like like like like like like like like like like like like like like like like like like like like like like like like like like like like like like like like like like like like like like like like like like like like like like like like like like like like like like like like like like like like like like like like like like like like like like like like like like like like like like like like like like like like like like like like like like like like like like like like like like like like like like like like like like like like like like like like like like like like like like like like like like like like like like like like like like like like like like like like like like like like like like like like like like like like like like like like like like like like like like like like like like like like like like like like like like like like like like like like like like like like like like like like like like like like like like like like like like like like like like like like like like like like like like like like like like like like like like like like like like like like like like like like like like like like like like like like like like like like like like like like like like like like like like like like like like like like like like like like like like like like like like like like like like like like like like like like like like like like like like,[ID]like like like like like like like like like like like like like like like like like like like like like like like like like like like like like like like like like like like like like like like like like like like like like like like like like like like like like like like like like like like like like like like like like like like like like like like like like like like like like like like like like like like like like like like like like like like like like like like like like like like like like like like like like like like like like like like like like like like like like like like like like like like like like like like like like like like like like like like like like like like like like like like like like like like like like like like like like like like like like like like like like like like like like like like like like like like like like like like like like like like like like like like like like like like like like like like like like like like like like like like like like like like like like like like like like like like like like like like like like like like like like like like like like like like like like like like like like like like like like like like like like like like like like like like like like like like like like like like like like like like like like like like like like like like like like like like like like like like like like like like like like like like like like like like like like like like like like like like like like like like like like like like like like like like like like like like like like like like like like like like like like like like like like like like like like like like like like like like like like like like like like like like like like like like like like like like like like like like like like like like like like like like like like like like like like like like like like like like like like like like like like like like like like like like like like like like like like like like like like like like like like like like like like like like like like like like like like like like like like like like like like like like like like like like like like like like like like like like like like like like like like like like like[/ID],"Maaf, saya tidak mengerti apa yang Anda maksud.",D:\Semester6\NLP\Prak\UAS\UAS-Praktikum-Pemrosesan-Bahasa-Alami\outputs\tts\2325_audio4_resp_preserve_cs.wav,
2325_audio5.wav,2325,audio5,True,preserve_cs,ok,49.458039599936455,客客宝宝宝宝宝宝宝宝宝宝宝宝宝宝宝宝宝宝宝宝宝宝宝宝宝宝宝宝宝宝宝宝宝宝宝宝宝宝宝宝宝宝宝宝宝宝宝宝宝宝宝宝宝宝宝宝宝宝宝宝宝宝宝宝宝宝宝宝宝宝宝宝宝宝宝宝宝宝宝宝宝宝宝宝宝宝宝宝宝宝宝宝宝宝宝宝宝宝宝宝宝宝宝宝宝宝宝宝宝宝宝宝宝宝宝宝宝宝宝宝宝宝宝宝宝宝宝宝宝宝宝宝宝宝宝宝宝宝宝宝宝宝宝宝宝宝宝宝宝宝宝宝宝宝宝宝宝宝宝宝宝宝宝宝宝宝宝宝宝宝宝宝宝宝宝宝宝宝宝宝宝宝宝宝宝宝宝宝宝宝宝宝宝宝宝宝宝宝宝宝宝宝宝宝宝宝宝宝宝宝宝宝宝宝宝宝宝宝宝宝,客客宝宝宝宝宝宝宝宝宝宝宝宝宝宝宝宝宝宝宝宝宝宝宝宝宝宝宝宝宝宝宝宝宝宝宝宝宝宝宝宝宝宝宝宝宝宝宝宝宝宝宝宝宝宝宝宝宝宝宝宝宝宝宝宝宝宝宝宝宝宝宝宝宝宝宝宝宝宝宝宝宝宝宝宝宝宝宝宝宝宝宝宝宝宝宝宝宝宝宝宝宝宝宝宝宝宝宝宝宝宝宝宝宝宝宝宝宝宝宝宝宝宝宝宝宝宝宝宝宝宝宝宝宝宝宝宝宝宝宝宝宝宝宝宝宝宝宝宝宝宝宝宝宝宝宝宝宝宝宝宝宝宝宝宝宝宝宝宝宝宝宝宝宝宝宝宝宝宝宝宝宝宝宝宝宝宝宝宝宝宝宝宝宝宝宝宝宝宝宝宝宝宝宝宝宝宝宝宝宝宝宝宝宝宝宝宝宝宝宝宝,[ID]客客宝宝宝宝宝宝宝宝宝宝宝宝宝宝宝宝宝宝宝宝宝宝宝宝宝宝宝宝宝宝宝宝宝宝宝宝宝宝宝宝宝宝宝宝宝宝宝宝宝宝宝宝宝宝宝宝宝宝宝宝宝宝宝宝宝宝宝宝宝宝宝宝宝宝宝宝宝宝宝宝宝宝宝宝宝宝宝宝宝宝宝宝宝宝宝宝宝宝宝宝宝宝宝宝宝宝宝宝宝宝宝宝宝宝宝宝宝宝宝宝宝宝宝宝宝宝宝宝宝宝宝宝宝宝宝宝宝宝宝宝宝宝宝宝宝宝宝宝宝宝宝宝宝宝宝宝宝宝宝宝宝宝宝宝宝宝宝宝宝宝宝宝宝宝宝宝宝宝宝宝宝宝宝宝宝宝宝宝宝宝宝宝宝宝宝宝宝宝宝宝宝宝宝宝宝宝宝宝宝宝宝宝宝宝宝宝宝宝宝宝[/ID],"Maaf, saya tidak mengerti apa yang Anda maksud.",D:\Semester6\NLP\Prak\UAS\UAS-Praktikum-Pemrosesan-Bahasa-Alami\outputs\tts\2325_audio5_resp_preserve_cs.wav,
2325_audio6.wav,2325,audio6,True,preserve_cs,ok,117.57633069995791,Lhhhhhhhhhhhhhhhhhhhhhhhhhhhhhhhhhhhhhhhhhhhhhhhhhhhhhhhhhhhhhhhhhhhhhhhhhhhhhhhhhhhhhhhhhhhhhhhhhhhhhhhhhhhhhhhhhhhhhhhhhhhhhhhhhhhhhhhhhhhhhhhhhhhhhhhhhhhhhhhhhhhhhhhhhhhhhhhhhhhhhhhhhhhhhhhhhhhhhhhhhhhhhhhhhhhhhhhhhhhhhh,Lhhhhhhhhhhhhhhhhhhhhhhhhhhhhhhhhhhhhhhhhhhhhhhhhhhhhhhhhhhhhhhhhhhhhhhhhhhhhhhhhhhhhhhhhhhhhhhhhhhhhhhhhhhhhhhhhhhhhhhhhhhhhhhhhhhhhhhhhhhhhhhhhhhhhhhhhhhhhhhhhhhhhhhhhhhhhhhhhhhhhhhhhhhhhhhhhhhhhhhhhhhhhhhhhhhhhhhhhhhhhhh,[ID]Lhhhhhhhhhhhhhhhhhhhhhhhhhhhhhhhhhhhhhhhhhhhhhhhhhhhhhhhhhhhhhhhhhhhhhhhhhhhhhhhhhhhhhhhhhhhhhhhhhhhhhhhhhhhhhhhhhhhhhhhhhhhhhhhhhhhhhhhhhhhhhhhhhhhhhhhhhhhhhhhhhhhhhhhhhhhhhhhhhhhhhhhhhhhhhhhhhhhhhhhhhhhhhhhhhhhhhhhhhhhhhh[/ID],"Maaf, saya tidak mengerti apa yang Anda maksud.",D:\Semester6\NLP\Prak\UAS\UAS-Praktikum-Pemrosesan-Bahasa-Alami\outputs\tts\2325_audio6_resp_preserve_cs.wav,
2325_audio7.wav,2325,audio7,True,preserve_cs,ok,40.59510899987072,E-E-E-E-E-E-E-E-E-E-E-E-E-E-E-E-E-E-E-E-E-E-E-E-E-E-E-E-E-E-E-E-E-E-E-E-E-E-E-E-E-E-E-E-E-E-E-E-E-E-E-E-E-E-E-E-E-E-E-E-E-E-E-E-E-E-E-E-E-E-E-E-E-E-E-E-E-E-E-E-E-E-E-E-E-E-E-E-E-E-E-E-E-E-E-E-E-E-E-E-E-E-E-E-E-E-E-E-E-E-E-E-E-E-E-E-E-E-E-E-E-E-E-E-E-E-E-E-E-E-E-E-E-E-E-E-E-E-E-E-E-E-E-E-E-E-E-E-E-E-E-E-E-E-E-E-E-E-E-E-E-E-E-E-E-E-E-E-E-E-E-E-E-E-E-E-E-E-E-E-E-E-E-E-E-E-E-E-E-E-E-E-E-E-E-E-E-E-E-E-E-E-E-E-E-E-E-E-E-E-E-E-E-E-E-E-E-E-E-E-E-E-,E-E-E-E-E-E-E-E-E-E-E-E-E-E-E-E-E-E-E-E-E-E-E-E-E-E-E-E-E-E-E-E-E-E-E-E-E-E-E-E-E-E-E-E-E-E-E-E-E-E-E-E-E-E-E-E-E-E-E-E-E-E-E-E-E-E-E-E-E-E-E-E-E-E-E-E-E-E-E-E-E-E-E-E-E-E-E-E-E-E-E-E-E-E-E-E-E-E-E-E-E-E-E-E-E-E-E-E-E-E-E-E-E-E-E-E-E-E-E-E-E-E-E-E-E-E-E-E-E-E-E-E-E-E-E-E-E-E-E-E-E-E-E-E-E-E-E-E-E-E-E-E-E-E-E-E-E-E-E-E-E-E-E-E-E-E-E-E-E-E-E-E-E-E-E-E-E-E-E-E-E-E-E-E-E-E-E-E-E-E-E-E-E-E-E-E-E-E-E-E-E-E-E-E-E-E-E-E-E-E-E-E-E-E-E-E-E-E-E-E-E-E-,[ID]E-E-E-E-E-E-E-E-E-E-E-E-E-E-E-E-E-E-E-E-E-E-E-E-E-E-E-E-E-E-E-E-E-E-E-E-E-E-E-E-E-E-E-E-E-E-E-E-E-E-E-E-E-E-E-E-E-E-E-E-E-E-E-E-E-E-E-E-E-E-E-E-E-E-E-E-E-E-E-E-E-E-E-E-E-E-E-E-E-E-E-E-E-E-E-E-E-E-E-E-E-E-E-E-E-E-E-E-E-E-E-E-E-E-E-E-E-E-E-E-E-E-E-E-E-E-E-E-E-E-E-E-E-E-E-E-E-E-E-E-E-E-E-E-E-E-E-E-E-E-E-E-E-E-E-E-E-E-E-E-E-E-E-E-E-E-E-E-E-E-E-E-E-E-E-E-E-E-E-E-E-E-E-E-E-E-E-E-E-E-E-E-E-E-E-E-E-E-E-E-E-E-E-E-E-E-E-E-E-E-E-E-E-E-E-E-E-E-E-E-E-E-[/ID],"Maaf, saya tidak mengerti apa yang Anda maksud.",D:\Semester6\NLP\Prak\UAS\UAS-Praktikum-Pemrosesan-Bahasa-Alami\outputs\tts\2325_audio7_resp_preserve_cs.wav,
2325_audio8.wav,2325,audio8,True,preserve_cs,ok,41.75399259990081,Like like like like like like like like like like like like like like like like like like like like like like like like like like like like like like like like like like like like like like like like like like like like like like like like like like like like like like like like like like like like like like like like like like like like like like like like like like like like like like like like like like like like like like like like like like like like like like like like like like like like like like like like like like like like like like like like like like like like like like like like like like like like like like like like like like like like like like like like like like like like like like like like like like like like like like like like like like like like like like like like like like like like like like like like like like like like like like like like like like like like like like like like like like like like like like like like like like like like like like like like like like like like like like like like like like like like like like like like like like like like like like like like like like like like like like like like like like like like like like like like like like like like like like like like like like like like like like like like like like like like like like like like like like like like like like like like like like like like like like like like like like like like like like like like like like like like like like like like like like like like like like like like like like like like like like like like like like like like like like like like like like like like like like like like like like like like like like like like like like like like like like like like like like like like like like like like like like like like like like like like like like like like like like like like like like like like like like like like like like like like like like like like like like like like like like like like like like like like like like like like like like like like like like like like like like like like like like like like like like like like like like like like like like like like like like like like like like like like like like like like like like like like,Like like like like like like like like like like like like like like like like like like like like like like like like like like like like like like like like like like like like like like like like like like like like like like like like like like like like like like like like like like like like like like like like like like like like like like like like like like like like like like like like like like like like like like like like like like like like like like like like like like like like like like like like like like like like like like like like like like like like like like like like like like like like like like like like like like like like like like like like like like like like like like like like like like like like like like like like like like like like like like like like like like like like like like like like like like like like like like like like like like like like like like like like like like like like like like like like like like like like like like like like like like like like like like like like like like like like like like like like like like like like like like like like like like like like like like like like like like like like like like like like like like like like like like like like like like like like like like like like like like like like like like like like like like like like like like like like like like like like like like like like like like like like like like like like like like like like like like like like like like like like like like like like like like like like like like like like like like like like like like like like like like like like like like like like like like like like like like like like like like like like like like like like like like like like like like like like like like like like like like like like like like like like like like like like like like like like like like like like like like like like like like like like like like like like like like like like like like like like like like like like like like like like like like like like like like like like like like like like like like like like like like like like like like like like like like like like like like like like like like like like like like like like,[ID]Like like like like like like like like like like like like like like like like like like like like like like like like like like like like like like like like like like like like like like like like like like like like like like like like like like like like like like like like like like like like like like like like like like like like like like like like like like like like like like like like like like like like like like like like like like like like like like like like like like like like like like like like like like like like like like like like like like like like like like like like like like like like like like like like like like like like like like like like like like like like like like like like like like like like like like like like like like like like like like like like like like like like like like like like like like like like like like like like like like like like like like like like like like like like like like like like like like like like like like like like like like like like like like like like like like like like like like like like like like like like like like like like like like like like like like like like like like like like like like like like like like like like like like like like like like like like like like like like like like like like like like like like like like like like like like like like like like like like like like like like like like like like like like like like like like like like like like like like like like like like like like like like like like like like like like like like like like like like like like like like like like like like like like like like like like like like like like like like like like like like like like like like like like like like like like like like like like like like like like like like like like like like like like like like like like like like like like like like like like like like like like like like like like like like like like like like like like like like like like like like like like like like like like like like like like like like like like like like like like like like like like like like like like like like like like like like like like like like like like like like like like like like[/ID],"Maaf, saya tidak mengerti apa yang Anda maksud.",D:\Semester6\NLP\Prak\UAS\UAS-Praktikum-Pemrosesan-Bahasa-Alami\outputs\tts\2325_audio8_resp_preserve_cs.wav,
2325_audio9.wav,2325,audio9,True,preserve_cs,ok,40.42283369996585,ya ya ya ya ya ya ya ya ya ya ya ya ya ya ya ya ya ya ya ya ya ya ya ya ya ya ya ya ya ya ya ya ya ya ya ya ya ya ya ya ya ya ya ya ya ya ya ya ya ya ya ya ya ya ya ya ya ya ya ya ya ya ya ya ya ya ya ya ya ya ya ya ya ya ya ya ya ya ya ya ya ya ya ya ya ya ya ya ya ya ya ya ya ya ya ya ya ya ya ya ya ya ya ya ya ya ya ya ya ya ya ya ya ya ya ya ya ya ya ya ya ya ya ya ya ya ya ya ya ya ya ya ya ya ya ya ya ya ya ya ya ya ya ya ya ya ya ya ya ya ya ya ya ya ya ya ya ya ya ya ya ya ya ya ya ya ya ya ya ya ya ya ya ya ya ya ya ya ya ya ya ya ya ya ya ya ya ya ya ya ya ya ya ya ya ya ya ya ya ya ya ya ya ya ya ya ya ya ya ya ya ya ya ya ya ya ya ya ya ya ya ya ya ya ya ya ya ya ya ya ya ya ya ya ya ya ya ya ya ya ya ya ya ya ya ya ya ya ya ya ya ya ya ya ya ya ya ya ya ya ya ya ya ya ya ya ya ya ya ya ya ya ya ya ya ya ya ya ya ya ya ya ya ya ya ya ya ya ya ya ya ya ya ya ya ya ya ya ya ya ya ya ya ya ya ya ya ya ya ya ya ya ya ya ya ya ya ya ya ya ya ya ya ya ya ya ya ya ya ya ya ya ya ya ya ya ya ya ya ya ya ya ya ya ya ya ya ya ya ya ya ya ya ya ya ya ya ya ya ya ya ya ya ya ya ya ya ya ya ya ya ya ya ya ya ya ya ya ya ya ya ya ya ya ya ya ya ya ya ya ya ya ya ya ya ya ya ya ya ya ya ya ya ya ya ya ya ya ya ya ya ya ya ya ya ya ya ya ya ya ya ya ya ya ya ya ya ya ya ya ya ya ya ya ya ya ya ya ya ya ya ya ya ya,ya ya ya ya ya ya ya ya ya ya ya ya ya ya ya ya ya ya ya ya ya ya ya ya ya ya ya ya ya ya ya ya ya ya ya ya ya ya ya ya ya ya ya ya ya ya ya ya ya ya ya ya ya ya ya ya ya ya ya ya ya ya ya ya ya ya ya ya ya ya ya ya ya ya ya ya ya ya ya ya ya ya ya ya ya ya ya ya ya ya ya ya ya ya ya ya ya ya ya ya ya ya ya ya ya ya ya ya ya ya ya ya ya ya ya ya ya ya ya ya ya ya ya ya ya ya ya ya ya ya ya ya ya ya ya ya ya ya ya ya ya ya ya ya ya ya ya ya ya ya ya ya ya ya ya ya ya ya ya ya ya ya ya ya ya ya ya ya ya ya ya ya ya ya ya ya ya ya ya ya ya ya ya ya ya ya ya ya ya ya ya ya ya ya ya ya ya ya ya ya ya ya ya ya ya ya ya ya ya ya ya ya ya ya ya ya ya ya ya ya ya ya ya ya ya ya ya ya ya ya ya ya ya ya ya ya ya ya ya ya ya ya ya ya ya ya ya ya ya ya ya ya ya ya ya ya ya ya ya ya ya ya ya ya ya ya ya ya ya ya ya ya ya ya ya ya ya ya ya ya ya ya ya ya ya ya ya ya ya ya ya ya ya ya ya ya ya ya ya ya ya ya ya ya ya ya ya ya ya ya ya ya ya ya ya ya ya ya ya ya ya ya ya ya ya ya ya ya ya ya ya ya ya ya ya ya ya ya ya ya ya ya ya ya ya ya ya ya ya ya ya ya ya ya ya ya ya ya ya ya ya ya ya ya ya ya ya ya ya ya ya ya ya ya ya ya ya ya ya ya ya ya ya ya ya ya ya ya ya ya ya ya ya ya ya ya ya ya ya ya ya ya ya ya ya ya ya ya ya ya ya ya ya ya ya ya ya ya ya ya ya ya ya ya ya ya ya ya ya ya ya ya ya ya ya ya ya ya ya ya ya ya ya ya,[ID]ya ya ya ya ya ya ya ya ya ya ya ya ya ya ya ya ya ya ya ya ya ya ya ya ya ya ya ya ya ya ya ya ya ya ya ya ya ya ya ya ya ya ya ya ya ya ya ya ya ya ya ya ya ya ya ya ya ya ya ya ya ya ya ya ya ya ya ya ya ya ya ya ya ya ya ya ya ya ya ya ya ya ya ya ya ya ya ya ya ya ya ya ya ya ya ya ya ya ya ya ya ya ya ya ya ya ya ya ya ya ya ya ya ya ya ya ya ya ya ya ya ya ya ya ya ya ya ya ya ya ya ya ya ya ya ya ya ya ya ya ya ya ya ya ya ya ya ya ya ya ya ya ya ya ya ya ya ya ya ya ya ya ya ya ya ya ya ya ya ya ya ya ya ya ya ya ya ya ya ya ya ya ya ya ya ya ya ya ya ya ya ya ya ya ya ya ya ya ya ya ya ya ya ya ya ya ya ya ya ya ya ya ya ya ya ya ya ya ya ya ya ya ya ya ya ya ya ya ya ya ya ya ya ya ya ya ya ya ya ya ya ya ya ya ya ya ya ya ya ya ya ya ya ya ya ya ya ya ya ya ya ya ya ya ya ya ya ya ya ya ya ya ya ya ya ya ya ya ya ya ya ya ya ya ya ya ya ya ya ya ya ya ya ya ya ya ya ya ya ya ya ya ya ya ya ya ya ya ya ya ya ya ya ya ya ya ya ya ya ya ya ya ya ya ya ya ya ya ya ya ya ya ya ya ya ya ya ya ya ya ya ya ya ya ya ya ya ya ya ya ya ya ya ya ya ya ya ya ya ya ya ya ya ya ya ya ya ya ya ya ya ya ya ya ya ya ya ya ya ya ya ya ya ya ya ya ya ya ya ya ya ya ya ya ya ya ya ya ya ya ya ya ya ya ya ya ya ya ya ya ya ya ya ya ya ya ya ya ya ya ya ya ya ya ya ya ya ya ya ya ya ya ya ya ya ya ya ya ya ya ya ya ya ya[/ID],"Maaf, saya tidak mengerti apa yang Anda maksud.",D:\Semester6\NLP\Prak\UAS\UAS-Praktikum-Pemrosesan-Bahasa-Alami\outputs\tts\2325_audio9_resp_preserve_cs.wav,
